<?xml version="1.0" encoding="UTF-8"?>

<!ELEMENT employees (department+)>
<!ELEMENT department (name, emp_id, age, salary)>
<!ELEMENT name (#PCDATA)> 
<!ELEMENT emp_id (#PCDATA)> 
<!ELEMENT age (#PCDATA)> 
<!ELEMENT salary (#PCDATA)> 